ID,Data Provider,Project Name,Consumer Team,Consumer Name,Consumer Description,Purpose,Realistic?,Decision?
f43e3914f3e8110aaedcea54dd9781057c917aee5a2bf3cb50fb727e1486d361,Underwriting Life Insurance,Predictive Loan Default Modeling,contracts,Loan Default Predictor,A predictive tool for assessing default risks among policyholders to inform financial decision-making.,"The Contracts team proposes using creditworthiness data to develop predictive models for loan default risk among policyholders. This analysis will assist in identifying high-risk individuals and adjusting contract terms accordingly. By proactively managing this risk, the organization seeks to minimize financial losses and enhance the overall health of the loan portfolio, ensuring economic stability and profitability in lending operations.","Yes, this is a realistic access request for a plausible use case.",Accept
b35b001d2c2c2926feff474c97eab61c46c11dbb5a6dbe90a382086561986a72,Underwriting Life Insurance,Claims Processing Optimization,claims--benefit,Claims Workflow Optimizer,Software to streamline claims processes by leveraging underwriting data to inform decisions.,"The Claims & Benefit team seeks access to health risk assessments and exclusive third-party data as part of their effort to optimize claims processing workflows. By understanding the risk profiles comprehensively, the team aims to streamline claims adjudication processes, minimizing processing times, and improving claim resolution rates. This enhancement is expected to elevate customer satisfaction while reducing operational costs associated with prolonged claims handling.","Yes, this is a realistic access request for a plausible use case.",Accept
5de826f8638ff6dd168934eb3da55530f3b28d04f50b7e2da0e3026a73c8ea38,Underwriting Life Insurance,Third-Party Risk Assessment Integration,actor,Third-Party Risk Manager,A comprehensive platform evaluating third-party risks and strengthening partnerships.,"The Actor team proposes integrating exclusive third-party data and public risk data for a refined third-party risk assessment framework. This integration will enable a more holistic view of potential exposures associated with third-party partnerships, enhancing risk management strategies. By evaluating these relationships in detail, the company aims to mitigate operational risks, ensuring stakeholder confidence and secure business operations.","Yes, this is a realistic access request for a plausible use case.",Reject
a832a6f4996c5c43bee02d3b780ec4d9f3af0b0eba60ce713742adeb9c0d946a,Underwriting Life Insurance,New Customer Acquisition Strategy,marketing,Customer Acquisition Platform,Strategic tool to enhance new customer acquisition using targeted demographic analyses.,"The Marketing unit seeks to employ public mortality models along with creditworthiness data to craft a new customer acquisition strategy. By identifying demographics with favorable life expectancy and financial stability, the team aims to target new potential customers more effectively. This focused approach is expected to enhance market penetration efforts and drive new business growth by leveraging precise demographic and economic insight within targeted initiatives.","Yes, this is a realistic access request for a plausible use case.",Accept
3e9d3c17b0c949ed56f74adb44a8efd003c3d031797ba2bf40eab4984da48d97,Marketing Campaigns,Customer Segmentation Enhancement,underwriting,Segment Insight Enhancer,Enhances customer segmentation models by integrating various data sources for better targeting of underwriting offers.,"To improve customer segmentation models, we aim to integrate marketing campaign data with existing demographic and behavioral data to tailor product offerings more precisely. The data on campaign start and end dates, target customer profiles, and campaign performance will help us identify segments that respond well to specific campaigns, ultimately enhancing our marketing strategy and increasing policy renewal rates.","Yes, this is a realistic access request for a plausible use case.",Accept
98c61e5352f29a42098aed4080fbaec30a64e3ed9e4851e064141ec04a1cfdd0,Marketing Campaigns,Claims Forecasting Accuracy,claims--benefit,Predictive Claims Modeler,"Uses diverse data inputs to refine predictions related to claims frequency and severity, enhancing resource allocation.","By incorporating marketing campaign data, including target customer profiles and campaign success metrics, into our claims forecasting models, we aim to improve the accuracy of claims predictions. Analyzing this data will allow us to ascertain if there are correlations between campaign targets and claim filing behaviors, thus enabling better risk management.","Yes, this is a realistic access request for a plausible use case.",Accept
3e6df138892d6908a28f951eec68f5cc902c778c4db63e23540b9c7e0bdd4f6b,Marketing Campaigns,Policy Customization Algorithm,contracts,Custom Policy Advisor,Enhances the customer interaction experience by recommending personalized policy options based on data-driven insights.,"With access to marketing campaign performance data, we aim to refine algorithms that suggest personalized policies to customers. By understanding which campaigns led to policy upgrades, we can enhance the algorithm's capacity to push similar suggestions in future interactions, thereby increasing customer satisfaction and policy conversions.","Yes, this is a realistic access request for a plausible use case.",Accept
90edf4d6463329dcfe15858336fcc551ee608cc60ade70bfb2f743925b8265c5,Marketing Campaigns,Fraud Detection Enhancement,claims--benefit,Advanced Fraud Alert System,Identifies and flags potential fraudulent claims by analyzing behavioral anomalies and consistency in customer interactions.,"Our objective is to utilize marketing campaign data to amplify our fraud detection models. By analyzing discrepancies between campaign-targeted profiles and claimants, we aim to identify potential fraudulent activities, which could stem from unauthorized access or manipulation during campaigns, ensuring the integrity of our claims process.","No, this access request is unrealistic.",Reject
0ef1c80eb3c57b2e6cca3237f9150b24c19508a4457969a0cff5ba4b5665e859,Marketing Campaigns,Competitive Positioning Analysis,actor,Competitive Insights Dashboard,Provides market positioning reports and competitive analysis insights to guide strategic business decisions.,"We seek to analyze marketing campaign data to understand our competitive positioning. By examining campaign success metrics, especially regarding customer acquisition and retention, we aim to benchmark against industry standards, helping us identify gaps and refine our market strategies accordingly.","Yes, this is a realistic access request for a plausible use case.",Accept
b831ed3e0e096652ebf1dbb49c09bbcd81e630b292ee1ee990c68e34ae135c0d,Marketing Campaigns,Cross-Sell Opportunity Maximizer,contracts,Cross-Sell Predictor,Predicts and identifies potential cross-selling opportunities leveraging historical and current customer data.,"Integrating marketing campaign data, particularly those detailing successful target profiles and campaign outcomes, will enable us to identify cross-selling opportunities within the current customer base. This data serves to predict customers' propensity to purchase additional products, turning insights into actionable offers.","Yes, this is a realistic access request for a plausible use case.",Accept
94620844868947b8301d9020ea5a43e1735ca5f2e6aa6b425857158536775371,Marketing Campaigns,Behavioral Analysis in Underwriting,underwriting,Behavioral Assumption Recalibrator,Innovates underwriting processes by correlating marketing-driven consumer behaviors with risk evaluation models.,"We intend to study marketing targets and their buying behaviors to enhance our underwriting practices. By integrating campaign data that highlights target customer profiles with policy uptake information, we aim to reevaluate our risk assumptions and adjust underwriting criteria accordingly.","Yes, this is a realistic access request for a plausible use case.",Accept
27e5f9403e8803129d37ac775a164df0c74ac9cb8a8935b4aa82a50082682b19,Marketing Campaigns,Policyholder Retention Analytics,contracts,Retention Insight Tool,Analyzes and predicts policyholder retention trends by leveraging comprehensive marketing and policy data.,"Our goal is to utilize marketing campaign data to better understand factors influencing policyholder retention. By analyzing the efficiency and impact of campaigns on customer engagement, we can derive insights leading to enhanced customer loyalty initiatives, ultimately improving retention rates.","Yes, this is a realistic access request for a plausible use case.",Accept
b996e57f625ba5a93e4cc70ddb09583be42678227126aabe7506d1a9732a748f,Marketing Campaigns,Risk Profile Adjustment Modeling,underwriting,Dynamic Risk Modeler,Improves risk management by applying dynamic models based on integrated behavioral and marketing data insights.,"Enhancing our understanding of customer behavior via marketing campaigns allows us to refine customer risk profiles. By evaluating campaign outcomes and customer actions, we aim to adjust risk assessment models to be more precise, ultimately aiding in the development of personalized risk-based pricing strategies.","Yes, this is a realistic access request for a plausible use case.",Accept
87dfbd32e8d97085612ccdd5678d8fe469e7d33f253e16f39c6366e098d624fd,Marketing Campaigns,Unauthorized Data Access Review,actor,Security Breach Analysis Tool,Detects unauthorized data access by examining inconsistencies and anomalies within campaign data flows.,"This request aims to examine marketing campaign data to identify and address any instances of unauthorized access to customer data. Analyzing the campaign data flow, especially around the campaign lifecycle periods, will help in early detection of potential breaches and prevent misuse of customer information.","Yes, this is a realistic access request for a plausible use case.",Accept
