ID,Data Provider,Project Name,Consumer Team,Consumer Name,Consumer Description,Purpose,Realistic?,Decision?
8392a6d9159cc8a43f7794b73694e375edddcaecc8afb25b686d8f2ffa7bc2c9,Benefit,Claims Risk Pattern Analysis,underwriting,Risk Insight Tool,A platform designed to offer in-depth risk insights through historical claims and beneficiary data analysis.,"To improve our risk assessment process, we aim to analyze the historical claims data to identify risk patterns associated with certain demographics and behaviors. By utilizing beneficiaries' data, we can create a risk profile for different customer segments, enhancing our underwriting criteria and premium predictions for future policies. The aim is to align policies more closely with actual risk, ultimately benefiting both the company through improved financial predictions and customers via fair and accurately priced insurance offerings.","Yes, this is a realistic access request for a plausible use case.",Accept
578fc7428282f7b993611f2001293896cf4d07c3d21bf7b9cdb5427db47b5cc4,Benefit,Customer Retention Strategy,marketing,Loyalty Enhancement Platform,A system designed to enhance customer retention through analysis of claims timing and reasons.,"To identify our most critical clients at risk of attrition, we plan to leverage the reason and date data to analyze recent claims trends. This will allow us to develop targeted retention strategies by understanding how the timing and reasons for claims influence customer dissatisfaction. By predicting these trends, we can proactively engage with these customers through personalized communication, ultimately aiming to reduce churn rates and enhance long-term customer loyalty.","No, this access request is unrealistic.",Reject
31db55b24dbe49bf94e9e4dfb72eeb4fb25b38b383dcdd78aaa2fa4e31da76f4,Benefit,Fraud Detection Enhancement,actor,FraudShield,A strategic application enhancing fraud detection through detailed claims data analysis.,"We seek to enhance our fraud detection capabilities by analyzing beneficiaries and payment information data to identify unusual claim patterns. This analysis will focus on cross-referencing payment anomalies with claim types and timing, helping to flag potential fraudulent activities early. This proactive approach will not only safeguard financial resources but will also improve the integrity of our claims processes, ensuring legitimate claims are processed efficiently.","Yes, this is a realistic access request for a plausible use case.",Accept
e424e08b361ecb2eed041f24a721bba39c15103e1984f3e85d4764f4dcea7784,Benefit,Behavioral Underwriting Insights,underwriting,Behavioral Insight Engine,Provides insights for refined underwriting processes through behavioral data analysis.,"To refine our underwriting methodologies, we will utilize data concerning beneficiaries and payment information to conduct a behavioral analysis. Our goal is to uncover the relationships between client demographics, previous claims, and underwriting risks. This will allow more tailored policy creations and adjustments, helping keep premiums competitive while ensuring the solvency and profitability of the insurance portfolio.","Yes, this is a realistic access request for a plausible use case.",Reject
72f2f494807873c5538a531b74d0e2eb3c2414d1a2beff92f53e5749a3883be2,Benefit,Policy Personalization Initiative,contracts,SmartPolicy Creator,A platform to align policy offerings more closely with customer needs and observed claim reasons.,"To enhance our policy personalization efforts, we aim to use reason data from the claimant's context. By understanding common reasons for claims, we can adjust coverage specificities and create more personalized insurance solutions. This will improve customer satisfaction by ensuring coverage aligns better with their expected needs, ultimately fostering stronger customer relationships and reducing dissatisfaction.","Yes, this is a realistic access request for a plausible use case.",Reject
d4ff8cc7eb39c6555258259773b2def6a4ce2b8b54a754db408184f3876c466f,Benefit,Marketing Target Optimization,marketing,Campaign Precision Tool,Optimizes marketing campaign timing and targeting based on client lifecycle and claim trends.,"To optimize the targeting of our marketing campaigns, especially those involving offers on additional financial services, we will use date and reason data fields. By identifying seasons or life-stage events that correlate to higher conversion rates, we can time promotions more effectively, increasing the likelihood of positive responses from potential clients. This strategic alignment can substantially enhance the effectiveness of our marketing efforts, ensuring that resources are directed toward the most receptive audiences.","No, this access request is unrealistic.",Reject
142e4fb86d9d5f1ace0539c5fbc6c7a9bf882d9248ad4a8003a3a5e6d6394209,Benefit,Strategic Claims API Development,actor,OpenClaim API,Enhances claim processing efficiency through strategic API development and integration.,"Tailoring our claim processing API requires a deep dive into beneficiaries and payment information data. This information helps identify potential integration points with third-party software, improving process efficiency and customer satisfaction. The intended outcome is to create more cohesive API systems that reduce claim processing time and improve transparency, thereby enhancing user experience and trust in our systems.","Yes, this is a realistic access request for a plausible use case.",Accept
c11af745bcf38d34268d01441aaeca7d65952b88b29bf84cb975a5e48d0ae803,Benefit,Claims Forecasting System,underwriting,Claims Predictor,Forecasts future claims potential to improve staffing and budget planning.,"For better resource allocation in claims management, we require access to beneficiary and date data. By developing models that forecast the likelihood of future claims based on past events, we can ensure that staffing and budget allocations in the claims department are optimized. The goal is to improve operational readiness and responsiveness, ultimately reducing processing delays and enhancing service provision during claims surges.","Yes, this is a realistic access request for a plausible use case.",Reject
9b65f2f2236bc85b26d1786f0b7a96fd739a453336bb573d5f484d48c3bf3b52,Benefit,Payment Integrity Monitor,contracts,FinGuard,Monitors payment activities to ensure financial accountability and irregularity detection.,"To safeguard against financial discrepancies in our claims payments process, we aim to analyze the payment information fields for irregularities. By detecting and addressing erroneous or unusual payment activities promptly, we can ensure financial accountability and transparency. This initiative will maintain trust with all stakeholders by upholding our commitment to precision and integrity in financial operations.","Yes, this is a realistic access request for a plausible use case.",Accept
173e64d0ee35a85c54bc6d0afcb31f54a12a4f7b50d6e6ec828c6c1f06e50f41,Benefit,Customer Experience Improvement,contracts,ClientConnect,Improves client interactions through enhanced understanding of claim context and timing.,"Leveraging reason and date data from the Benefit API, we aim to enhance our response strategies by understanding the contexts and timing of claims better. Being able to tailor communication and feedback loops based on these insights permits us to increase client satisfaction by providing faster, more relevant support and advice, which addresses their specific circumstances and needs during critical times.","Yes, this is a realistic access request for a plausible use case.",Reject
299c8e32afcdef46d804c7a2b49fbf9151dcbe29e90043270118b9318258e229,Life Insurance Contracts,Policyholder Data Enrichment,underwriting,Risk Assessment Tool,Optimizes premium calculations and underwriting decisions by incorporating detailed policyholder data.,"To enhance our underwriting models, we aim to integrate detailed policyholder data, such as age and smoking status, from the Life Insurance Contracts to improve risk assessment accuracy. This will allow us to offer more competitive premiums and ensure better pricing strategies tailored to individual risk profiles.","Yes, this is a realistic access request for a plausible use case.",Accept
3b5a95f87aa3a4e334a5991082808585dedc2531a3a8eddfe28e20ba9ed1455c,Life Insurance Contracts,Medical History Analysis for Fraud Detection,claims--benefit,Fraud Detection System,Detects potentially fraudulent claims by analyzing medical records and claims data.,Our goal is to analyze the medical records linked to past claims to identify patterns indicative of fraudulent behavior. This analysis will be crucial in reducing fraud rates and enhancing the integrity of our claims process.,"Yes, this is a realistic access request for a plausible use case.",Accept
b9a4865366feb253fe59726c67d3ce20cf7f87e6b776be6bb3d16b470584b098,Life Insurance Contracts,Customer Profiling for Personalized Marketing,marketing,Customer Profiling Engine,Generates customer profiles to tailor marketing campaigns for improved engagement.,"We seek to leverage policyholder base data to create personalized marketing campaigns that resonate more with individual customers. By understanding their demographics and past insurance preferences, we can increase engagement and loyalty.","Yes, this is a realistic access request for a plausible use case.",Reject
a123ff379b4304b724362b7d33ce51c74fa25197af337882f4228124ce94a4af,Life Insurance Contracts,Enhanced Retention Strategies,marketing,Retention Strategy Analyzer,Analyzes historical data to devise strategies for improving customer retention rates.,"By analyzing historical data on premiums and contract terms, we aim to develop strategies to minimize policy lapses. Understanding how contract adjustments or premium changes impact retention will help us design better customer retention strategies.","Yes, this is a realistic access request for a plausible use case.",Reject
da958b0b63d472ca70041221670114a15d1defd007bb2abb939afe781042a69e,Life Insurance Contracts,Agent Performance Insights,actor,Agent Performance Dashboard,"Monitors and evaluates agent performance, guiding improvement strategies.","Accessing agent performance data, including metrics such as agent commission correlated with contract outcomes, will allow us to identify high-performing agents and recognize best practices. This will facilitate targeted training programs and optimize sales strategies.","Yes, this is a realistic access request for a plausible use case.",Reject
a686d94a1c154beedb96f9df1fcfbb31d467f08858faa472c4baca8b25b95a48,Life Insurance Contracts,Pre-Approval Underwriting Analysis,underwriting,Pre-Approval Analysis Tool,Automates underwriting processes to accelerate the pre-approval phase and improve customer experience.,"Integrating detailed policyholder data, such as prior medical records and base data, into our underwriting models will streamline the pre-approval process. This effort aims to expedite application reviews and enhance overall customer satisfaction.","Yes, this is a realistic access request for a plausible use case.",Accept
16de1121d6a816ea5986959a1fa9271ef1e40eee7449b1f40cd5fa7466ed5576,Life Insurance Contracts,Insight Generation for Premium Adjustments,underwriting,Premium Adjustment Platform,Provides insights that guide dynamic premium setting strategies based on historical analysis.,We intend to utilize sum insured and premium data to analyze the correlation between coverage levels and premium adjustments. This will inform our pricing models and ensure they're responsive to competitive changes and shifts in policyholder demand.,"Yes, this is a realistic access request for a plausible use case.",Accept
55b95bdb81eb412d2ce229bca7de26e793877b212fa59ba41006d660c41698b0,Life Insurance Contracts,Beneficiary Verification,claims--benefit,Beneficiary Verification Tool,Confirms beneficiary data to secure the legitimacy of insurance claims.,"To ensure the reliability of our policy payouts, we must verify the identities of beneficiaries listed under policyholder accounts. Accessing names and relationship data will significantly enhance our payout accuracy and reduce fraudulent claims.","Yes, this is a realistic access request for a plausible use case.",Reject
6a45424c65f670cb4a1cd4ca4abcc75622b59f0a07594ae24f0b229c8ce5800a,Life Insurance Contracts,Life Event Trigger Identification,marketing,Life Event Trigger System,Identifies significant life changes for targeted upselling and customer engagement.,"Our goal is to understand significant life events like marriage or childbirth from policyholder data, which can serve as triggers for targeted upselling opportunities and personalized policy adjustments, thereby enhancing engagement and growth.","Yes, this is a realistic access request for a plausible use case.",Reject
287d727b1ae59250edadcd8d38e9585e72e3b9a872458bd5fa93036dafb87dee,Life Insurance Contracts,Agent Incentive Program Analysis,actor,Agent Incentive Analyzer,Evaluates incentive structures to align agent performance with organizational objectives.,"By analyzing the relationship between agent commissions and policyholder satisfaction, we aim to establish effective incentive programs that foster higher satisfaction rates and drive agent performance alignment with company goals.","Yes, this is a realistic access request for a plausible use case.",Reject
ccf085ed0eca44d6c24d68f764389e2d6b1d182ffedffa60d99cc70d59d37272,Actor,Customer Trust Analysis,marketing,Customer Trust Management,Enhances customer relations and trust by improving communication related to data and privacy practices.,"To enhance customer trust, we seek to analyze contact info and historical data usage consents from actors with existing contracts. Our aim is to identify trends and improve transparency with customers regarding data sharing practices. Understanding these patterns helps us build confidence among policyholders, potentially increasing satisfaction and loyalty. This analysis will focus on improving how we communicate our privacy practices and identify any improvements needed in our data usage approach.","Yes, this is a realistic access request for a plausible use case.",Accept
37fa85ba016c5b23aeeab56f01170bbdafaaeb853a83a843c9617482ef67a27e,Actor,Data-Driven Customer Outreach,marketing,Personalized Outreach Engine,Customizes outreach strategies tailored to individual customer preferences and behaviors to boost conversion rates.,"Our goal is to tailor communication with potential policyholders by analyzing their payment methods and consents for data usage. By understanding how customers prefer to interact financially and their consent for marketing, we can customize our messages to align with their preferences. This targeted approach is expected to improve engagement rates and conversion efficiency, ultimately contributing to better customer service and growth in policy sales.","Yes, this is a realistic access request for a plausible use case.",Accept
4ad861cf2fd4fe2a6bfd111155a4fccc16b08d3df9e29920c634dff4e6d95e0f,Actor,Risk Assessment Enhancement,underwriting,Enhanced Risk Assessment Tool,Utilizes advanced analytics to improve risk scoring by integrating digital and historical contract data.,"In order to refine our underwriting risk assessments, we request access to online account activities and links to past contracts. This data will be used to identify patterns indicative of potential risk factors not evident through traditional metrics. Understanding the digital footprint and historical contract data assists in creating more accurate risk profiles, thereby enhancing the precision of coverage assessments and decisions.","Yes, this is a realistic access request for a plausible use case.",Accept
8bb79c71c2c26f3e0a50ff08da40750acd7ae677ab2063ef21c8657579e68faf,Actor,Cross-sell Opportunities Discovery,marketing,Cross-sell Intelligence Platform,Identifies and suggests profitable cross-sell insurance products to existing customers based on their purchase patterns.,"By analyzing existing contract links and payment information, we aim to identify potential cross-sell opportunities within our existing customer base. Recognizing the patterns and associations between recently purchased contracts and linked accounts can guide efforts to propose additional useful insurance products to the right clients at the right time, thus optimizing customer lifetime value and satisfaction.","Yes, this is a realistic access request for a plausible use case.",Accept
b149a2a869bc5197b3e7033b99b7d28c26651f8bc072da37ab542109bdc4e048,Actor,Fraud Detection Enhancement,claims--benefit,Enhanced Fraud Detection Solution,Leverages digital behavior and payment data to identify and address potential fraudulent claim activities.,"Utilizing detailed records of actor payment methods and activity levels in online accounts, our goal is to strengthen fraud detection mechanisms. These indicators, juxtaposed with existing claim patterns, aid in identifying anomalies that suggest fraudulent activity. By doing so, we aim to protect policyholders and the company from potential losses, maintaining the integrity of our insurance processes.","Yes, this is a realistic access request for a plausible use case.",Accept
8542fd448abb4070ba8d661455c75f06ceae2f9323a775de1341fd3d91cb5fa3,Actor,Contract Renewal Prediction,contracts,Renewal Forecasting Model,Anticipates contract renewal opportunities through analysis of historic contract data and predicted changes in customer preferences.,"We intend to forecast contract renewals by examining actor's past contract history and their data usage consent. By refining our prediction capabilities, we can preemptively address customer needs, leading to smoother renewal processes. This proactive method supports retaining more clients, ultimately, sustaining stable revenues and reducing churn rates.","No, this access request is unrealistic.",Accept
432fb8a48ecc0d440192903e44c6d3306cf9b14a985fcc9a64333635a03d1c5e,Actor,Premium Adjustment Justification,underwriting,Premium Analysis and Justification Tool,Justifies premium adjustments by evaluating customer risk through payment and contract data.,"Our aim is to justify premium rate adjustments by analyzing actor payment methods and linked contracts. Understanding the basis of current risk and payment patterns allows us to provide precise rationale for changes in premium prices, creating transparency for customers. By justifying these adjustments, we can foster better understanding and acceptance among policyholders.","Yes, this is a realistic access request for a plausible use case.",Accept
ab19af49dfaf765c37a9852fbfac73328cdbc036ac141b7b69dc0f72121611fb,Actor,Automatic Claim Processing,claims--benefit,Automated Claims Handler,Streamlines the claim verification process by automatically validating customer identity through prior contact and payment information.,"To facilitate automatic processing of claims, our application requires access to actor's contact info and payment methods to validate identity and streamline claim verification processes. This automation aims to improve operational efficiency, reducing turnaround times and elevating customer satisfaction by promptly addressing claims while ensuring data verification is robust and concise.","Yes, this is a realistic access request for a plausible use case.",Accept
eb0464e13d4264a8417e636f88b9d43e7d2f97d2e6a06637fae987c9a1a3f8fc,Actor,Targeted Marketing Campaigns,marketing,Precision Marketing Generator,Designs data-driven marketing strategies and campaigns targeting suitable potential customers.,"To enhance our marketing campaigns, we request access to actors' data usage consents and payment information. Understanding target audience preferences and purchasing behaviors will boost campaign relevance and engagement. By strategically crafting marketing initiatives based on this data, we foster higher customer acquisition and retention, driving business growth.","Yes, this is a realistic access request for a plausible use case.",Accept
1a75519c2f97e276bb5fb1d3494405b45de776bbe847b78f8c15efbc2951b485,Actor,Underwriting Audit Enhancement,underwriting,Underwriting Compliance Checker,Assures underwriting accuracy and compliance through comprehensive verification of financial and account data.,"We require access to actors' payment information and online account history for audit purposes. Our goal is to ensure compliance and integrity in underwriting processes by verifying data accuracy and identifying inconsistencies. This audit aims to uphold the highest standards in underwriting, contribute to process optimization, and bolster trust in our insurance offerings.","Yes, this is a realistic access request for a plausible use case.",Accept
e94f4f3ee3fe7fbdfd7e4b3a79f7c4a43d70ed5c772432828d61b16207793f51,Underwriting Life Insurance,Risk Scoring Analysis for New Contracts,contracts,Risk Scoring Platform,A platform that calculates risk scores for new insurance contracts using underwriting data.,"The Contracts team aims to utilize the health risk assessment and creditworthiness data from the Underwriting Life Insurance API to develop a comprehensive risk scoring system for evaluating new contracts. This system will enhance decision-making by predicting potential risks associated with policyholders, thus ensuring more precise underwriting. This data-driven approach will streamline risk assessment processes, leading to reduced manual errors and time savings while maximizing business value through enhanced risk prediction capabilities.","Yes, this is a realistic access request for a plausible use case.",Accept
fac6f5f3584daa491041adc14e93328f8d935df07736e0ce3e63b7a9be3fc210,Underwriting Life Insurance,Healthcare Marketing Campaign Targeting,marketing,Targeted Health Campaign Manager,A data application designed to tailor marketing campaigns specifically for audiences most interested in health insurance.,"The Marketing team plans to leverage public mortality models and health risk assessments to identify and target demographics likely to be interested in health-related insurance products. By analyzing this data, the team can devise highly targeted and effective campaigns, ensuring that marketing efforts resonate with the right audience. This initiative aims to improve customer engagement metrics and conversion rates, directly impacting the company's market presence and profitability.","Yes, this is a realistic access request for a plausible use case.",Accept
02105f9beb185bc84b5b8b36efa59804bc24c9d98b410a39a4d6bce19d4de7f4,Underwriting Life Insurance,Fraud Detection Enhancement System,claims--benefit,Fraud Detection Enhancement System,"Advanced system for detecting fraudulent claims by analyzing complex data patterns, including credit and third-party data.","The Claims & Benefit unit seeks to incorporate creditworthiness and exclusive third-party data into its Fraud Detection Enhancement System. By analyzing anomalies within these data categories, the system will identify potentially fraudulent claims more accurately. This integration aims to safeguard the company's financial resources by minimizing fraudulent payouts, improving detection rates, and reducing investigation times. Subsequently, this will maintain the integrity of claims processing and uphold customer trust.","Yes, this is a realistic access request for a plausible use case.",Accept
ab69b150ceb6c95ac766140389d6a38cd994394bd1ab55a7eb1063d152c76303,Underwriting Life Insurance,Customer Behavioral Prediction Analysis,marketing,Behavior Prediction Analyzer,A tool designed to predict customer behaviors impacting policy renewals and retention strategies.,"The Marketing division intends to utilize public risk data and health risk assessments to perform customer behavioral predictions. By forecasting potential customer behaviors, such as policy renewals or lapse likelihoods, the team can strategically tailor retention programs and personalized offers. This utilization of predictive analytics will boost customer retention rates and drive up long-term value, optimizing customer lifecycle management.","Yes, this is a realistic access request for a plausible use case.",Reject
5dcb6e66943e3aaebcc437340d2d1c1fc24f7f63cad51c00fe1ea7571c763588,Underwriting Life Insurance,Legal Compliance and Assurance Audits,actor,Compliance Assurance Audit Tool,A robust audit tool to ensure legal compliance using detailed underwriting data.,"The Actor team requests access to public mortality models and public risk data for legal compliance assurance audits. By ensuring compliance with regulatory standards, the team will help mitigate legal risks and enhance the organization's reputation. This process involves cross-referencing insurance data against public data to verify adherence to legal norms, safeguarding against potential regulatory breaches and associated penalties.","Yes, this is a realistic access request for a plausible use case.",Accept
f1f87a97b3dd323f998a2d29791af62eed42de380a4875bcb7db67883590587a,Underwriting Life Insurance,Comprehensive Market Analysis,marketing,Market Analysis Engine,Provides a detailed understanding of market dynamics and consumer credit trends for strategic development.,"To gain a competitive edge, the Marketing team plans to exploit exclusive third-party data and creditworthiness metrics for comprehensive market analysis. By understanding market trends and consumer credit behaviors, the team aims to develop innovative products tailored to market demands. This strategic insight will help identify emerging market opportunities and improve competitive positioning, thereby boosting market share and brand recognition.","Yes, this is a realistic access request for a plausible use case.",Accept
